{
  "$schema": "https://json-schema.org/draft/2020-12/schema",
  "$id": "https://rigsmith.dev/schemas/changeset-config.json",
  "title": "Changeset config",
  "description": "Configuration for changerig / @changesets, read from .changeset/config.json (or a \"changeset\" key in a release/shiprig file).",
  "type": "object",
  "additionalProperties": true,
  "properties": {
    "baseBranch": {
      "type": "string",
      "description": "The branch releases are cut from (default \"main\")."
    },
    "access": {
      "type": "string",
      "enum": [
        "public",
        "restricted"
      ],
      "description": "Default publish access for packages (default \"restricted\")."
    },
    "ignore": {
      "type": "array",
      "items": {
        "type": "string"
      },
      "description": "Package names (exact or '*' globs) never released, tagged, or published."
    },
    "privatePackages": {
      "description": "Whether private packages (\"private\": true) are versioned and tagged. Unset or false: neither, and a private package is treated as ignored (the @changesets v3 default).",
      "oneOf": [
        { "const": false },
        {
          "type": "object",
          "properties": {
            "version": { "type": "boolean", "description": "Version private packages and write their changelogs." },
            "tag": { "type": "boolean", "description": "Create git tags for private packages." }
          },
          "additionalProperties": false
        }
      ]
    },
    "fixed": {
      "type": "array",
      "items": {
        "type": "array",
        "items": {
          "type": "string"
        }
      },
      "description": "Groups of packages that always version together at the same number."
    },
    "linked": {
      "type": "array",
      "items": {
        "type": "array",
        "items": {
          "type": "string"
        }
      },
      "description": "Groups of packages whose versions are linked but bump independently."
    },
    "updateInternalDependencies": {
      "type": "string",
      "enum": [
        "patch",
        "minor"
      ],
      "description": "How far dependents of a changed package are bumped (default \"patch\")."
    },
    "versionStrategy": {
      "type": "string",
      "enum": [
        "lockstep",
        "independent"
      ],
      "description": "How a shared version is written: \"lockstep\" (default) moves every inheritor together; \"independent\" writes an inline version per package."
    },
    "snapshot": {
      "type": "object",
      "additionalProperties": true,
      "description": "Snapshot-release settings.",
      "properties": {
        "useCalculatedVersion": {
          "type": "boolean"
        },
        "prereleaseTemplate": {
          "type": "string"
        }
      }
    },
    "format": {
      "description": "Changelog formatter: null/false (off) | a name string (e.g. \"native\", \"prettier\") | an argv array for a custom formatter command.",
      "type": [
        "boolean",
        "string",
        "array",
        "null"
      ]
    },
    "changelog": {
      "description": "Changelog generator: null/false (the default layout), a name (a built-in, `changeset-changelog-<name>` on $PATH, or a path), or a [name, options] tuple, whose options value the generator receives as its request's `options`.",
      "type": [
        "boolean",
        "string",
        "array",
        "null"
      ]
    },
    "commit": {
      "description": "Whether to auto-commit: null/false (off), true, or a [resolver, options] tuple.",
      "type": [
        "boolean",
        "array",
        "null"
      ]
    },
    "changelogGroups": {
      "type": "array",
      "description": "Maps conventional-commit types to a changelog section and implied bump; empty falls back to built-in defaults.",
      "items": {
        "type": "object",
        "additionalProperties": true,
        "properties": {
          "type": {
            "type": "string",
            "description": "Conventional-commit type, e.g. \"feat\", \"fix\", \"perf\"."
          },
          "section": {
            "type": "string",
            "description": "Changelog section heading, e.g. \"\ud83d\ude80 Enhancements\"."
          },
          "bump": {
            "type": "string",
            "enum": [
              "major",
              "minor",
              "patch"
            ],
            "description": "Version bump this type implies."
          }
        }
      }
    },
    "changelogScopes": {
      "type": "array",
      "description": "Order scopes appear within a changelog section, e.g. [\"rig\",\"clauderig\"]. Scopes left out follow alphabetically; unscoped entries always come last. Omit for alphabetical order throughout.",
      "items": {
        "type": "string"
      }
    },
    "paths": {
      "type": "array",
      "items": {
        "type": "string"
      },
      "description": "Repo-relative roots (globs allowed) to narrow package discovery; empty scans the whole repo."
    },
    "versioning": {
      "$ref": "#/$defs/versioning"
    },
    "contributors": {
      "type": "object",
      "additionalProperties": true,
      "description": "Configures the trailing \"\u2764\ufe0f Contributors\" changelog section.",
      "properties": {
        "enabled": {
          "type": "boolean",
          "description": "Turns the section on (off by default)."
        },
        "excludeBots": {
          "type": "boolean",
          "description": "Drops authors whose login/name looks like a bot (default true), from the Contributors section and from changelog-github's \"Thanks\"."
        },
        "exclude": {
          "type": "array",
          "items": {
            "type": "string"
          },
          "description": "Author logins, names, or emails to omit (glob '*' supported), from the Contributors section and from changelog-github's \"Thanks\"."
        },
        "section": {
          "type": "string",
          "description": "Overrides the section heading."
        }
      }
    },
    "issues": {
      "type": "object",
      "additionalProperties": true,
      "description": "Configures the release `issues` step (commenting on / closing resolved issues).",
      "properties": {
        "enabled": {
          "type": "boolean",
          "description": "Turns the step on; false is a no-op."
        },
        "comment": {
          "type": "string",
          "description": "Comment body template; {{version}} expands to released versions."
        },
        "close": {
          "type": "boolean",
          "description": "Closes issues referenced with a closing keyword."
        }
      }
    },
    "release": {
      "$ref": "https://rigsmith.dev/schemas/shiprig.json",
      "description": "Cross-tool key carrying the shiprig pipeline config in a unified file."
    },
    "dotnet": {
      "$ref": "#/$defs/ecosystem"
    },
    "node": {
      "$ref": "#/$defs/ecosystem"
    },
    "go": {
      "$ref": "#/$defs/ecosystem"
    },
    "cargo": {
      "$ref": "#/$defs/ecosystem"
    }
  },
  "$defs": {
    "versioning": {
      "type": "object",
      "additionalProperties": true,
      "description": "Selects where release intent comes from (changesets, commits, or both).",
      "properties": {
        "source": {
          "type": "string",
          "enum": [
            "changesets",
            "commits",
            "both"
          ],
          "description": "\"changesets\" (default) reads on-disk changeset files; \"commits\" synthesizes from conventional commits; \"both\" unions them."
        },
        "scopes": {
          "type": "object",
          "additionalProperties": {
            "type": "string"
          },
          "description": "Maps a conventional-commit scope to a package name for attribution."
        },
        "initialRelease": {
          "type": "object",
          "additionalProperties": true,
          "description": "Tunes a package's first release (no prior tag) under commit-based versioning.",
          "properties": {
            "collapse": {
              "type": "boolean",
              "description": "Condenses the whole history into one changelog line."
            },
            "summary": {
              "type": "string",
              "description": "The single line's text (default \"Initial release\")."
            },
            "bump": {
              "type": "string",
              "enum": [
                "major",
                "minor",
                "patch"
              ],
              "description": "Bump for the collapsed first release (default \"minor\")."
            }
          }
        },
        "stamp": {
          "type": "boolean",
          "default": true,
          "description": "When false, `version` computes the new versions, consumes the changesets and writes the changelogs, but writes nothing into the manifests; the numbers are recorded in .changeset/versions.json for the release pipeline (${version.<pkg>}) and the build. For manifests that are not this repository's to write (a stackspace's members) or versions computed at build time (MinVer)."
        },
        "bumpMinorPreMajor": {
          "type": "boolean",
          "default": false,
          "description": "When true, a major bump on a package below 1.0.0 releases as a minor (0.3.0 → 0.4.0), as release-please's bump-minor-pre-major does. 1.0.0 is then reached with an explicit --release-as (or releaseAs). Off, as canon @changesets: a major on 0.x goes to 1.0.0."
        },
        "record": {
          "type": "boolean",
          "default": false,
          "description": "When true, keeps a release record in .changeset/versions.json (`released`): `version` writes the version every package it releases lands at, stamped or not, and `doctor` checks manifests and tags against it, like release-please's manifest. Never read as a version source. Canon @changesets keeps no record, so it's off by default."
        }
      }
    },
    "ecosystem": {
      "type": "object",
      "additionalProperties": true,
      "description": "Per-ecosystem config block (dotnet/node/go/cargo).",
      "properties": {
        "sourcePath": {
          "type": "string",
          "description": "Narrows this ecosystem's discovery to a repo-relative root."
        },
        "packageSource": {
          "type": "string",
          "description": "Overrides the publish feed/registry for this ecosystem."
        },
        "auth": {
          "type": "string",
          "description": "Registry credential as a secret ref: \"op://\u2026\", \"env:NAME\", or \"cmd:\u2026\". For dotnet it also answers a private feed's read (publish-plan's version check), sent only when the feed asks."
        },
        "oidc": {
          "type": "string",
          "enum": [
            "auto",
            "off"
          ],
          "description": "Trusted publishing via CI OIDC identity: \"auto\" (default) or \"off\"."
        },
        "user": {
          "type": "string",
          "description": "Registry account/subject some OIDC exchanges require (e.g. NuGet), and, for dotnet, the account name sent with `auth` to a private feed that checks it."
        },
        "publishDirs": {
         "type": "array",
         "items": {
          "type": "string"
         },
         "description": "Repo-relative globs naming package directories a build generates rather than sources checked in (npm binary wrappers built from release artifacts, e.g. \"npm/dist/*\"). Published, never versioned; a glob matching nothing is not an error. Honored by node."
        },
        "versionStrategy": {
          "type": "string",
          "enum": [
            "lockstep",
            "independent"
          ],
          "description": "Overrides the top-level versionStrategy for this ecosystem."
        },
        "signing": {
          "type": "object",
          "additionalProperties": true,
          "description": "Optional code-signing/notarization for desktop ecosystems.",
          "properties": {
            "enabled": {
              "type": "boolean"
            },
            "env": {
              "type": "object",
              "additionalProperties": {
                "type": "string"
              },
              "description": "Maps build-tool env vars to secret refs."
            },
            "signers": {
              "type": "array",
              "items": {
                "type": "object",
                "additionalProperties": true,
                "properties": {
                  "extensions": {
                    "type": "array",
                    "items": {
                      "type": "string"
                    }
                  },
                  "tool": {
                    "type": "string",
                    "enum": [
                      "command",
                      "azure-trusted-signing"
                    ]
                  },
                  "command": {
                    "type": "array",
                    "items": {
                      "type": "string"
                    }
                  },
                  "endpoint": {
                    "type": "string"
                  },
                  "account": {
                    "type": "string"
                  },
                  "certificateProfile": {
                    "type": "string"
                  },
                  "timestampUrl": {
                    "type": "string"
                  }
                }
              }
            }
          }
        }
      }
    }
  }
}
