{
  "$schema": "https://rigsmith.dev/schemas/changeset-config.json",
  "versioning": {
    "source": "changesets",
    "initialRelease": {
      "collapse": true,
      "summary": "Initial release",
      "bump": "major"
    }
  },
  "baseBranch": "main",
  "changelogScopes": [
    "rig",
    "clauderig",
    "clauderig-ui",
    "codexrig",
    "brewrig"
  ],
  "access": "restricted",
  "updateInternalDependencies": "patch",
  "ignore": [
    "@acme/cli",
    "@acme/core",
    "@acme/utils",
    "@demo/app",
    "@demo/core",
    "Demo.App",
    "Demo.Core",
    "Net10",
    "Net8",
    "app",
    "changesets-fixture",
    "crate-a",
    "crate-b",
    "demo-app",
    "demo-core",
    "demo.example/app",
    "demo.example/core",
    "example.com/poly/a",
    "example.com/poly/b",
    "lib",
    "rigsmith-site",
    "shiprig-electron-demo",
    "shiprig-tauri-demo"
  ],
  "linked": [],
  "fixed": []
}
